{
  "role": "MANAGER",
  "version": "1.1",
  "content": {
    "project_goal": "RMSEスコア7以内を目指した弁当販売数予測モデルの構築",
    "analysis_plan": [
      "データ概要の把握と可視化（EDA）",
      "欠損値処理（kcal, precipitation）",
      "外れ値の確認と処理",
      "曜日、完売フラグ、給料日フラグ、天気、気温、降水量、イベント有無などの特徴量エンジニアリング",
      "日付関連の特徴量（月、日、年、週番号など）の生成",
      "モデル選択（LightGBM, XGBoost, Ridge Regression など：GBDT 系は高い予測性能、Ridge は線形ベースラインとして有用）",
      "モデル学習とハイパーパラメータチューニング",
      "予測精度の評価（RMSE を主指標としつつ、MAE や R2 も併用して多角的に評価）",
      "提出直前のフェーズで提出用データのフォーマット確認（yyyy-m-d形式）"
    ],
    "priority": "EDAとデータクリーニングを最優先で実施し、特徴量エンジニアリングの基盤を固める"
  },
  "metadata": {
    "timestamp": "2026-02-28T16:37:00"
  }
}